{
  "name": "Software System Structure Ontology",
  "version": "1.0.0",
  "type": "upper",
  "description": "Upper ontology for software systems organized in six facets: Structure (what it is), Behavior (what it does), Operations (how it runs), Resilience (what goes wrong), Quality (how good it is), Evolution (how it changed). Complements the Development Knowledge Ontology which covers patterns, insights, and decisions.",

  "facets": [
    "structure",
    "behavior",
    "operations",
    "resilience",
    "quality",
    "evolution"
  ],

  "entities": {

    "_comment_structure": "=== FACET 1: STRUCTURE — What it IS ===",

    "File": {
      "facet": "structure",
      "description": "A single source file — the atomic unit of the code hierarchy",
      "properties": {
        "path": {
          "type": "string",
          "description": "Relative path from project root",
          "required": true
        },
        "language": {
          "type": "string",
          "description": "Programming language",
          "enum": ["typescript", "javascript", "python", "shell", "json", "yaml", "markdown", "other"]
        },
        "purpose": {
          "type": "string",
          "description": "Brief description of what this file does"
        },
        "complexity": {
          "type": "string",
          "description": "Coarse complexity assessment",
          "enum": ["low", "medium", "high"],
          "facet": "quality"
        },
        "testCoverage": {
          "type": "string",
          "description": "Degree of test coverage",
          "enum": ["none", "partial", "full"],
          "facet": "quality"
        }
      },
      "requiredProperties": ["path"],
      "examples": [
        "integrations/mcp-server-semantic-analysis/src/stdio-proxy.ts",
        "scripts/generate-docker-mcp-config.sh"
      ]
    },

    "Service": {
      "facet": "structure",
      "description": "A deployable or runnable unit composed of files",
      "properties": {
        "serviceName": {
          "type": "string",
          "description": "Human-readable service name",
          "required": true
        },
        "serviceType": {
          "type": "string",
          "description": "Kind of service",
          "enum": ["server", "proxy", "ui", "cli", "library", "agent", "worker"]
        },
        "entryPoint": {
          "type": "string",
          "description": "Main file that starts the service"
        },
        "maturity": {
          "type": "string",
          "description": "Lifecycle stage of the service",
          "enum": ["prototype", "active", "stable", "deprecated", "sunset"],
          "facet": "quality"
        },
        "architectureStyle": {
          "type": "string",
          "description": "Primary architectural style",
          "enum": ["event-driven", "request-response", "pipeline", "pub-sub", "batch"],
          "facet": "quality"
        },
        "patterns": {
          "type": "array",
          "description": "Coding/design patterns employed in this service",
          "items": { "type": "string" },
          "facet": "quality",
          "examples": ["proxy", "circuit-breaker", "observer", "factory", "middleware-chain"]
        }
      },
      "requiredProperties": ["serviceName", "serviceType"],
      "examples": [
        "semantic-analysis-proxy (proxy, active)",
        "system-health-dashboard (ui, stable)",
        "vkb-server (server, active)"
      ]
    },

    "Feature": {
      "facet": "structure",
      "description": "A user-facing capability composed of one or more services",
      "properties": {
        "featureName": {
          "type": "string",
          "description": "Human-readable feature name",
          "required": true
        },
        "description": {
          "type": "string",
          "description": "What this feature provides to the user"
        },
        "maturity": {
          "type": "string",
          "description": "Lifecycle stage of the feature",
          "enum": ["prototype", "active", "stable", "deprecated", "sunset"],
          "facet": "quality"
        }
      },
      "requiredProperties": ["featureName"],
      "examples": [
        "MCP Tool Integration (stable)",
        "Knowledge Graph Visualization (active)",
        "Continuous Learning Pipeline (prototype)"
      ]
    },

    "_comment_behavior": "=== FACET 2: BEHAVIOR — What it DOES ===",

    "Contract": {
      "facet": "behavior",
      "description": "A specification of what a component promises to do — the intended behavior, interface, and invariants. This is the 'positive' counterpart to Fault (which captures what goes wrong).",
      "properties": {
        "contractName": {
          "type": "string",
          "description": "Human-readable name for this contract",
          "required": true
        },
        "description": {
          "type": "string",
          "description": "What this contract specifies"
        },
        "inputs": {
          "type": "array",
          "description": "What the contract accepts",
          "items": { "type": "string" }
        },
        "outputs": {
          "type": "array",
          "description": "What the contract produces",
          "items": { "type": "string" }
        },
        "protocol": {
          "type": "string",
          "description": "Interaction protocol",
          "enum": ["rest", "sse", "stdio", "ws", "function-call", "cli", "event"]
        },
        "invariants": {
          "type": "array",
          "description": "Conditions that must always hold",
          "items": { "type": "string" }
        }
      },
      "requiredProperties": ["contractName"],
      "examples": [
        "MCP stdio-to-SSE bridge: accepts MCP requests on stdin, forwards to SSE server, returns responses on stdout",
        "Health endpoint: GET /health returns JSON with service status, always responds within 5s",
        "Knowledge graph query: accepts Cypher-like query string, returns array of matching entities"
      ]
    },

    "_comment_operations": "=== FACET 3: OPERATIONS — How it RUNS ===",

    "RuntimeDiagnostics": {
      "facet": "operations",
      "description": "Observable diagnostic output available while the system runs",
      "properties": {
        "channel": {
          "type": "string",
          "description": "How the diagnostics are delivered",
          "enum": ["file", "stderr", "stdout", "endpoint", "docker-logs", "browser-console"],
          "required": true
        },
        "path": {
          "type": "string",
          "description": "File path, URL, or command to access the diagnostics"
        },
        "format": {
          "type": "string",
          "description": "Output format",
          "enum": ["text", "json", "structured"]
        },
        "rotation": {
          "type": "string",
          "description": "Log rotation policy, if any"
        }
      },
      "requiredProperties": ["channel"],
      "examples": [
        ".data/logs/mcp-proxy-semantic-analysis.log (file, text)",
        "docker logs coding-services (docker-logs, text)",
        "http://localhost:3033/health (endpoint, json)"
      ]
    },

    "StaticDiagnostics": {
      "facet": "operations",
      "description": "Checks that verify correctness without running the system",
      "properties": {
        "checkType": {
          "type": "string",
          "description": "Kind of static check",
          "enum": ["config-validation", "type-check", "lint", "schema", "dependency-audit"],
          "required": true
        },
        "command": {
          "type": "string",
          "description": "Shell command to run the check"
        },
        "path": {
          "type": "string",
          "description": "File or directory the check applies to"
        }
      },
      "requiredProperties": ["checkType"],
      "examples": [
        "npx tsc --noEmit (type-check)",
        "docker-compose config --quiet (config-validation)"
      ]
    },

    "Port": {
      "facet": "operations",
      "description": "A network port used for inter-component communication",
      "properties": {
        "portNumber": {
          "type": "number",
          "description": "Port number",
          "required": true
        },
        "protocol": {
          "type": "string",
          "description": "Communication protocol",
          "enum": ["http", "sse", "ws", "tcp"]
        },
        "host": {
          "type": "string",
          "description": "Host the port is bound to",
          "enum": ["localhost", "container", "0.0.0.0"]
        }
      },
      "requiredProperties": ["portNumber"],
      "examples": [
        "3848 (sse, localhost) — semantic-analysis",
        "8080 (http, localhost) — VKB server"
      ]
    },

    "Config": {
      "facet": "operations",
      "description": "A configuration source that controls system behavior",
      "properties": {
        "configPath": {
          "type": "string",
          "description": "File path relative to project root",
          "required": true
        },
        "format": {
          "type": "string",
          "description": "Configuration format",
          "enum": ["json", "yaml", "env", "sh", "toml"]
        },
        "scope": {
          "type": "string",
          "description": "Where this config applies",
          "enum": ["global", "project", "runtime"]
        }
      },
      "requiredProperties": ["configPath", "format"],
      "examples": [
        "claude-code-mcp-docker.json (json, project)",
        "docker/docker-compose.yml (yaml, project)"
      ]
    },

    "Container": {
      "facet": "operations",
      "description": "A Docker container or compose service",
      "properties": {
        "containerName": {
          "type": "string",
          "description": "Container or compose service name",
          "required": true
        },
        "image": {
          "type": "string",